[
  {
    "oeAnalyzerId": "legacy-42",
    "sourceId": "10.20.30.42",
    "name": "Legacy Hematology 42",
    "protocol": "ASTM",
    "identifierPattern": "OPENELIS.*MOCK.?HEMATOLOGY",
    "testMappings": ["WBC"],
    "testCodeLoinc": { "WBC": "6690-2" },
    "qcRules": [],
    "controlLots": []
  }
]
